Name,Title,Email
Eloise Kaizar,"Professor of Statistics, Department Chair",kaizar.1@osu.edu
Steephanson Anthonymuthu,Assistant Professor of Teaching Practice,anthonymuthu.1@osu.edu
Dena Asta,Associate Professor of Statistics,dasta@stat.osu.edu
Arnab Auddy,Assistant Professor,auddy.1@osu.edu
Jonathan Baker,Associate Professor of Teaching Practice & Director of the AMGEN STEM Gateway Learning Center,baker.375@osu.edu
Xiaoxuan Cai,Assistant Professor,cai.1083@osu.edu
Oksana Chkrebtii,Associate Professor of Statistics,oksana@stat.osu.edu
Michelle Everson,Professor of Teaching Practice,everson.50@osu.edu
Chris Hans,"Associate Professor of Statistics, Vice Chair for Undergraduate Studies and Administration",hans@stat.osu.edu
Radu Herbei,Professor of Statistics,herbei@stat.osu.edu
Kate Hu,Assistant Professor,hu.3125@osu.edu
Laura Kubatko,"Professor of Statistics and Evolution, Ecology and Organismal Biology",kubatko.2@osu.edu
Sebastian Kurtek,Professor of Statistics,kurtek.1@stat.osu.edu
Yoonkyung Lee,Professor of Statistics and Computer Science Engineering,yklee@stat.osu.edu
Shili Lin,Professor of Statistics,shili@stat.osu.edu
Steve MacEachern,College of Arts and Sciences Distinguished Professor of Statistics,snm@stat.osu.edu
Isa Marques,Assistant Professor,marques.130@osu.edu
Thomas Metzger,"Assistant Professor of Teaching Practice, Director of Undergraduate Programs",metzger.181@osu.edu
Jillian Morrison,Assistant Professor of Teaching Practice,morrison.1043@osu.edu
Omer Ozturk,Professor of Statistics,omer@stat.osu.edu
Sally Paganin,Assistant Professor of Statistics,paganin.1@osu.edu
Subhadeep Paul,Associate Professor of Statistics,paul.963@osu.edu
Mario Peruggia,Professor of Statistics,peruggia@stat.osu.edu
Andrew Richards,Assistant Professor of Teaching Practice,richards.1227@osu.edu
